title,journal,year,opening,label,score,neurodivergence
Melatonin: the body's natural sleep-promoting hormone,The Guardian,2018,"Prescriptions for short periods are considered safe, but there is little research into the long-term effects In daylight hours there is so little melatonin in the bloodstream that it is barely detectable. But when the sun goes down, the eyes...",neutral,0.985816240310669,intellectual_disability
Navigating unregulated frontiers of fertility field,The Washington Post,2024,"Vitaly Kushnir's fertility clinic offers to screen an embryo to predict a baby's sex, but the service can lead to ethically murky territory, like when a couple wanted it so their first child could be a boy.",neutral,0.9855160117149353,intellectual_disability
What 'Tropic Thunder' Thinks Is Funny,The Washington Post,2008,"I've been told to keep my sense of humor about the film ""Tropic Thunder,"" which opens this week. Despite my requests, I have not been given the chance to see the movie. But I've seen previews, read about it and read ...",neutral,0.9854604601860046,intellectual_disability
"For many, ableism dims the sheen of Tinseltown",The Washington Post,2020,"Tatiana A. Lee would rather be studying lines for an acting role. Instead, she is talking with me. About Blackness. About ableism. About Hollywood.",neutral,0.985393762588501,intellectual_disability
"'It doesn't make it better if I say it's my fault': Gregg Wallace, 58, admits his age 'could be' the reason his son Sid, 4, has autism but...",Mail Online,2023,"Gregg Wallace, 58, has discussed his son's autism and the possibility that his age is a factor in why Sid, four, has the developmental disability.",neutral,0.9852892756462097,intellectual_disability
Elderly made to share homes;Social Care,The Times,2004,"It should be simple -old people live in old people's homes, while younger people with learning disabilities are cared for at home or in specialist centres by learning disability services. But research shows that this isn't ...",neutral,0.9852806925773621,intellectual_disability
'Our miracle boy': Proud mum of 'Bobby the Brave' who refused to die when his life support was switched off reveals his incredible progress...,Mail Online,2019,"* Bobby was subjected to four hours of abuse at the hands of his uncle in 2014 * He was left with critical brain injuries, as well as spinal injuries among others",positive,0.8786858916282654,intellectual_disability
His amazing grace: The Pope is serenaded by Aretha Franklin and blesses a disabled man in front of hundreds of thousands in Philly,Mail Online,2015,"* Pope Francis arrived at the Festival of Families on Benjamin Franklin Parkway in Philadelphia Saturday evening * Aretha Franklin, The Fray and Sister Sledge performed for the Pope as well as hundreds of thousands of followers",positive,0.8786703944206238,intellectual_disability
TV royalty,The Boston Globe,2017,"A critic's guide to the best shows about the Brits, for commoners like us Once upon a time, Americans were not thrilled with the British monarchy. Perhaps you've heard of the Declaration of Independence, which established our distance from ...",positive,0.8686114549636841,intellectual_disability
‘The Story of Beautiful Girl’: Love among the disturbed and forgotten,Washington Post.com,2011,"The dedication is fair warning: Rachel Simon's ""The Story of Beautiful Girl"" is for ""those who were put away,"" for the generations of people with disabilities who for many years were locked in institutions, away from families, out of sight ...",positive,0.8662436008453369,intellectual_disability
Style's fresh look Breakthrough model takes a big step,New York Daily News,2015,"This incredible teen is changing the face of fashion. Australian model Madeline Stuart, who has Down syndrome, is making history with her runway debut in New York Fashion Week next month. The 18-year- old from Brisbane has been invited by ...",positive,0.8574230074882507,intellectual_disability
Saving the full promise of the Americans with Disabilities Act,The Boston Globe,2019,"This week, we honor the 29th anniversary of the Americans with Disabilities Act. People with intellectual and developmental disabilities and their families have been engaged in a long fight to secure federal civil rights protections against...",positive,0.8546642065048218,intellectual_disability
"Gigli, the sequel: how Ben Affleck and Jennifer Lopez gave their turkey a happy ending",The Telegraph Online,2022,"The 2003 bomb lost millions, derailed one of Hollywood's hottest romances, and ruined a director's career. What went wrong? In the latest bid by our nostalgic society to plunge backwards in time, the tabloid-baiting romance known as ...",positive,0.851331889629364,intellectual_disability
Love among the disturbed and forgotten,The Washington Post,2011,"The dedication is fair warning: Rachel Simon's ""The Story of Beautiful Girl"" is for ""those who were put away,"" for the generations of people with disabilities who for many years were locked in institutions, away ...",positive,0.8511453866958618,intellectual_disability
"CHOREOGRAPHED GENEROSITY; ""Dancing for Donations"" instructor teaches special needs students and donates the tuition to charities.",Tampa Bay Times,2017,"Sara Battaglia's love for dancing and generous heart has launched a feet-driven fundraising effort. When Battaglia first began holding free dance classes in her native Port Charlotte, she decided to ask parents for a small donation to go ...",positive,0.8421897888183594,intellectual_disability
Celebrating a United Nations of riders on Route 47 bus,The Philadelphia Inquirer,2016,"Diversity on wheels - that is SEPTA's Route 47 bus, a vital link between many of the city's established and emerging immigrant neighborhoods.",positive,0.8401035070419312,intellectual_disability
Court disallows `male sexual victimization' defense,Star-Tribune  Newspaper of the Twin Cities   Mpls.-St. Paul,1991,"The Minnesota Supreme Court has disallowed  a defense based on ""male sexual victimization syndrome""  and upheld the 1990 murder conviction of a Bloomington man.",negative,0.9989834427833557,ptsd
"Officials did not mishandle rape claims, jury finds",The Washington Post,2024,"A 24-year-old woman who sued school officials in Fairfax County for millions of dollars, saying they mishandled allegations more than a decade ago that she was raped, lost her case Wednesday when she was unable to convince a federal jury ...",negative,0.9989798665046692,ptsd
"Ex-pupil loses #75,000 claim for bullying.",The Independent - London,2000,"A TEENAGER lost her claim yesterday for #75,000 against the local authority she said failed to protect her from ""persistent"" bullying.",negative,0.9989737272262573,ptsd
Claim for bullying at school fails.,The Guardian,2000,"A teenager yesterday failed to win damages from her education authority, West Sussex county council, for allegedly failing to protect her from bullying.",negative,0.9989732503890991,ptsd
Police constable accused of laziness amid £200k lawsuit over work-related trauma,The Telegraph Online,2024,"Policeman claiming damages for alleged ‘psychological injuries’ spent most of his time smoking and watching cricket, court told A police constable who is suing his chief constable over trauma he claims he suffered at work has been accused of...",negative,0.9989722967147827,ptsd
#3m claim over penis operation.,The Guardian,1998,"AFORMER airline pilot left with a mutilated penis and a devastated life after an operation to ""uncircumsise"" him went disastrously wrong launched a #3m High Court damages claim yesterday against the surgeon who performed the ...",negative,0.9989694356918335,ptsd
"#800,000 payout for mutilation.",The Guardian,1998,"AFORMER British Airways pilot who was left with a mutilated penis after an ""uncircumcision"" operation went wrong, accepted a settlement of more than #800,000 yesterday.",negative,0.9989688396453857,ptsd
News - Charles's aide denies rape claim Accused servant dismissesallegations from `unreliable ...,The Daily Telegraph,2002,News - Charles's aide denies rape claim Accused servant dismisses allegations from `unreliable alcoholic' after ex-valet reveals himself as `victim'.,negative,0.9989681243896484,ptsd
Female Inmates Sue Over 'Pat Frisks' by Men,The New York Times,1998,"Six female inmates in New York State prisons filed a Federal lawsuit yesterday seeking to prevent male correction officers from frisking clothed women inmates, a practice the women said was degrading and sexually abusive and that violated ...",negative,0.9989659786224365,ptsd
$1.3 million awarded in malpractice case // A Wayzata woman who tookmigraine medications said she wasn't warned about the side effectsth...,Star-Tribune  Newspaper of the Twin Cities   Mpls.-St. Paul,1997,A woman who lost parts of her toes and has permanently deformed feet because of the side effect of prescription drugs has been awarded $1.3 million by a Hennepin County jury.,negative,0.9989649057388306,ptsd
Police still searching for missing Iraq vet,The Atlanta Journal - Constitution,2006,"Both Gwinnett police and private investigators still hope missing Iraq war veteran Jason Roark will turn up soon.    But as each day goes by, the prospects grow more dim, one investigator said.",neutral,0.9882405996322632,ptsd
To Hell and Back,The New York Times,1997,"'I am now very far from home,'' Aziz wrote in French on a piece of notebook paper on a plane from Dakar, Senegal, to New York. ''The people around me are probably going to a luxury room in a four- or ...",neutral,0.9874890446662903,ptsd
Veteran could use some help at holidays,St. Louis Post-Dispatch,2009,"0 Case 88 K is a military veteran suffering from post traumatic stress disorder. He receives treatment through the Veterans Affairs hospital, but he often lacks the transportation he needs to get to his doctor's appointments.",neutral,0.9871833324432373,ptsd
TRENDS & INNOVATIONS.,Investor's Business Daily,2002,"This year's El Nino may cause drier conditions in the Midwest and more storms in the South this winter, weather experts said. But it'll be weaker than the one in '97-'98.",neutral,0.9869720339775085,ptsd
The Cutting Edge,The Washington Post,1998,"BUSY PEOPLE FORGET PILLS   MORE THAN OLD PEOPLE  A busy schedule is more likely than mere old age to make people forget to take their medications, a University of Michigan study suggests.",neutral,0.9863727688789368,ptsd
Depression: the unlikely guest star of the year's most interesting TV,The Guardian,2015,"Shows such as Jessica Jones and Mr Robot changed the way mental illness and depression are depicted onscreen, but are labels such as ‘sadcom’ helpful – or do they oversimplify the situation?",neutral,0.9861504435539246,ptsd
"Isolation, other challenges make transition tough; Vets fight to fit in at college",The Detroit News,2008,"A growing number of veterans of the war in Iraq and Afghanistan are heading to Michigan colleges to cash in their GI Bill benefits, but many say the transition to unstructured college life can be just as jarring as their service overseas.   ...",neutral,0.9861387610435486,ptsd
Health - What's so special about psychotherapy?,The Independent - London,1997,"It may be good to talk - but it makes no difference who's listening, a new study shows. Jeremy Laurence reports.   These are difficult times for psychotherapists. They may be feeling in need of a little post-traumatic stress disorder ...",neutral,0.9861365556716919,ptsd
Juvenile offenders' karate classes attempt to kick ties to old gangs,Atlanta Journal and Constitution,1991,"Birmingham - Darryl coils in the middle of the floor, his brown eyes boring into his opponent in search of a weakness.   He has just evened the score, and the next point wins. He hopes to make a rar e double jump in karate by skipping from ...",neutral,0.9861293435096741,ptsd
Review/Television; Grand Old Man of Counterculture,The New York Times,1990,"The beard is whiter and some of the front teeth look brand new but George Carlin, once of Cardinal Hayes High School in the Bronx, gives no indication of losing his ability to connect with younger audiences. In his latest Home Box Office ...",neutral,0.9859640598297119,ptsd
Fascinating images reveal how the Red Cross helped WWI troops at a British military hospital during the first Christmas after the guns fell...,Mail Online,2017,* Black and white images showing wounded troops at Christmas provide a rare glimpse into World War One * Injured soldiers are seen recuperating at the Dartford Southern Upper Hospital in Kent during Christmas 1918,positive,0.9090860486030579,ptsd
Film offers new views of Lennon's murder,The Indianapolis Star,2023,"There are events that impact an entire generation – ""where were you when"" moments that remain seared in memory banks forever. D-Day. The assassination of President John F. Kennedy. Sept. 11. And, for Beatles fans around the world, the ...",positive,0.9017043709754944,ptsd
Khmer Rouge film spurs Cambodians worldwide to revisit buried history,The Christian Science Monitor,2010,"Cambodian diaspora revisits the country's brutal Khmer Rouge history in 'Enemies of the People,' a new documentary competing for an Oscar.",positive,0.8894780874252319,ptsd
Center here helps torture victims heal,St. Louis Post-Dispatch,2004,"* People -- adults and youths, new and longtime U.S. residents -- come from war-torn nations all over the world to re-establish a sense of self.",positive,0.8882719278335571,ptsd
"Old soldiers - We have learned nothing, warn veterans - Thoughts turnto past conflicts.",The Guardian,2001,"John Braidwood was 24 when he was dropped into hell, spiralling from the sky with the rest of 4 Para into the maelstrom of Arnhem.   Now, the old soldier keeps his memories in the blue leather box that holds his medals, and he speaks with ...",positive,0.8879688382148743,ptsd
The 'worst journey' revisited,Financial Times,2023,"Antarctica | A century on from 'the best adventure travel book ever written', Jamie Lafferty takes a new cruise plying the route of bygone polar explorers",positive,0.8827699422836304,ptsd
Let's bring troops home from our wars,The News-Gazette,2010,"This Veterans Day, we are writing as members of the Iraq Veterans Against the War (IVAW) to ask readers to reconsider what it means to support the troops.",positive,0.8806210160255432,ptsd
Playing computer game Tetris can reduce trauma flashbacks,The Daily Telegraph,2010,"Playing Tetris, the computer puzzle game, shortly after a traumatic experience could reduce ""flashbacks"", an Oxford University study has found.",positive,0.8761209845542908,ptsd
The Wall Speaks for All,The Washington Post,1999,Today the Vietnam Veterans Memorial has transcended its role as a national symbol of reconciliation and stands as a living history lesson. The memorial is unique in its ability to inspire exploration and reflection about this critical time ...,positive,0.8728369474411011,ptsd
Child abuse detective says parents MUST teach their children about consent from an early age with tactics like asking before you take their...,Mail Online,2022,* Kristi McVee worked as a detective on child abuse cases * Now educates parents keeping children safe from predators * Urged parents to talk to their kids about consent,positive,0.8713183403015137,ptsd
Judge to hear motion in Coleman case as city recognizes 'failures',The Boston Globe,2023,"Acknowledges it didn't turn over evidence in suit Seven years after a Boston police officer shot 31-year-old Terrence Coleman to death in the South End, the city has acknowledged that it failed to turn over evidence in a wrongful-death ...",negative,0.9989977478981018,schizophrenia
4 officers denied immunity over 2017 fatal arrest attempt,Independent Online,2021,Four Phoenix police officers were denied qualified immunity in a lawsuit over the death of a Black man during a 2017 arrest attempt in which one officer pressed his knee into the man’s neck and shoulder area,negative,0.9989890456199646,schizophrenia
Judge Rules Against Md. Psychiatrist; Patient at Perkins WasOvermedicated,The Washington Post,1991,"A Howard County judge has ruled that a psychiatrist at Maryland's hospital for the criminally insane overmedicated and secluded one of his patients out of spite, and has ordered the patient be paid $100 in compensation for the ...",negative,0.9989884495735168,schizophrenia
"2 Yrs. for kid shooter's ma ; Boy, 6, critically injured 1st grade teacher in Va. classroom",New York Daily News,2023,"The mother of a Virginia boy who shot and wounded his teacher back in January was sentenced on Friday to two years in prison. Deja Taylor pleaded guilty in August to felony child neglect in a plea deal with prosecutors, who in turn, agreed ...",negative,0.9989880919456482,schizophrenia
Ban threat to social worker,The Daily Express,2009,"Brandon council employee ignored file on repeat rapist A SOCIAL worker has been found guilty of 15 counts of serious misconduct, including failing to carry out a risk assessment on an alleged rapist who was then charged over another attack.",negative,0.9989798665046692,schizophrenia
We made error over Nelson Mandela sign language interpreter – government,Guardian.co.uk,2013,South African minister concedes mistake over interpreter's lack of qualifications and blames suppliers as being substandard The South African government has admitted that the sign language interpreter accused of gesticulating nonsense during ...,negative,0.9989683628082275,schizophrenia
Hospital not to blame for schizophrenic man’s fatal attack on fellow patients,thetimes.co.uk,2018,"It was a “monstrous outrage” that two elderly patients died after being attacked by a pensioner on a ward, a coroner said yesterday. Despite this, Kevin McLoughlin exonerated the hospital of any fault.",negative,0.9989664554595947,schizophrenia
N. Minn. senior home’s license suspended // Inspectors found health and safety violations that posed “an imminent risk.”,Star-Tribune,2018,More than 30 people are being forced to move out of a northern Minnesota senior home after state health regulators took the unusual action of suspending the facility’s license.,negative,0.9989656209945679,schizophrenia
Reckitt Benckiser files £1bn claim against former subsidiary Indivior files £1bn claim against former subsidiary,Financial Times (FT.Com),2020,Claim relates to US settlement over past marketing of opioid addiction treatment Suboxone Consumer goods group Reckitt Benckiser has filed a £1bn legal claim against Indivior related to an opioid addiction treatment sold by its former ...,negative,0.9989621639251709,schizophrenia
No help despite warnings: ex,New York Post,2023,"The man accused of randomly stabbing two teen tourists at Grand Central Terminal was a stalker who suffered from paranoid delusions and was in dire need of psychiatric help, his ex-girlfriend told The Post Wednesday.",negative,0.9989593029022217,schizophrenia
"On Thanksgiving, uncle found Salvi scared and distant",The Boston Globe,1996,"John C. Salvi 3d spoke wistfully of being free to once more swim in the cold Atlantic Ocean, but was largely distant during a Thanksgiving Day meeting with his uncle just hours before he was found dead in his cell at the state prison in ...",neutral,0.9871701002120972,schizophrenia
"Thrive has big plan$ (plans), few details for kids",New York Post,2020,"Mayor de Blasio and city First Lady Chirlane McCray rolled out a plan Monday for boosting counseling services for young people struggling during the pandemic - but included few details, such as a timeline or price tag.",neutral,0.9870573878288269,schizophrenia
DIRECT MAIL INDUSTRY DRAWS UP NEW CODE OF PRACTICE. (2 OF 2),The Observer,1990,"Despite the constraint, direct mail's practitioners are generally agreed that there is plenty of scope for creativity. Unlike television and press advertising, the mailshot is not restricted by considerations of time and space, and ...",neutral,0.9868240356445312,schizophrenia
Does Westworld tell a truer story than a novel can?,The Guardian,2016,The conventions of prose fiction are bound up with an understanding of life that feels more and more outdated – not so with this box-set drama,neutral,0.9867784976959229,schizophrenia
Brain illness study,The Times,2006,"Brain scans could be used to assess whether people with a family history of schizophrenia are likely to develop the illness, research in BioMed Central Medicine has suggested. Scientists have found that some people who develop the condition ...",neutral,0.9867691993713379,schizophrenia
MODERN FAMILIES,Financial Times,2018,"Life - and photography - have changed since 1994, when the exhibition 'Who's looking at the family?' made headlines. Nearly a quarter of a century on, curator Tim Clark decided to revisit the theme through the work of 14 contemporary ...",neutral,0.9866021871566772,schizophrenia
ON THE NEURON TRAIL OF COGNITIVE SKILLS,The Washington Post,1994,"Two parts of the brain that scientists believed were involved only in the control of movement may also be important for problem solving and other cognitive skills, new research suggests.",neutral,0.9864517450332642,schizophrenia
"People living longer, but with chronic ailments, study says ; Life expectancy is increasing around world",The Boston Globe,2012,"Life expectancy is increasing among the world's population, including in the United States, but people are living longer in chronic pain and with physical and mental disabilities, according to findings from the Global Burden of Disease ...",neutral,0.9862968921661377,schizophrenia
LETTERS Quantifying treatment,Atlanta Journal and Constitution,1995,"Managed care and outpatient mental health care do not make a good mix because HMOs are profit-oriented, whereas therapy must remain primarily sensitive to the patient.",neutral,0.9862609505653381,schizophrenia
Cheap and meaningful - design.,The Independent - London,1999,"If you thought kitsch started with the Lava Lamp, think again.Charles Darwent explores one of the more obscure cultural legacies of the Victorians",neutral,0.9861114025115967,schizophrenia
"How CIA scientist Sidney Gottlieb - the 'most prolific torturer of his generation' - used potent drugs, extreme temperatures, food and sleep...",Mail Online,2019,"* Over a period of twenty years as a scientist with the agency, Sidney Gottlieb ran the largest systematic search for mind control techniques in history",positive,0.9005342721939087,schizophrenia
To Hell With Him,The New York Times,1997,"How far the devil has fallen! In the new Al Pacino movie, ''Devil's Advocate,'' the Prince of Darkness -- Milton's majestic archangel whose ''stature reached the Sky'' -- has devolved into ...",positive,0.897711992263794,schizophrenia
"A Gothic Tennessee Williams Mash-Up, With Gorillas",The New York Times,2017,"Blow out your candles, Laura. And close your eyes. You might not want to see this. ''Glass Guignol: The Brother and Sister Play'' sutures together several of Tennessee Williams's dramas, using his relationship with his sister, Rose Williams,...",positive,0.8875320553779602,schizophrenia
A fairytale wedding for Lisa the heroine.,Daily Mail,2002,SIX years ago she suffered horrific injuries as she bravely shielded terrified nursery school children from a man wielding a machete.   Lisa Potts's act of heroism earned her a place in the nation's hearts and won her the George ...,positive,0.8832605481147766,schizophrenia
"Weekend: Enduring love: Ray Churchill cares for his wife, Rita, 51, and son, Mark, 19",The Guardian,2009,"Chris How long have you been a carer now? Ray Rita was first ill in '84, but it was '85 before she was diagnosed with schizophrenia and went into hospital. She was having a bad time hearing voices.",positive,0.8710265755653381,schizophrenia
Friday’s best TV: NCIS; An Island Parish: Falklands; Inside Cocaine Wars; The Returned,The Guardian,2015,"A prison ship fire sets terrorists free in NCIS, the Falklands are livened up with jam, a spaniel and a scout trip, and we follow the US war on drugs to Colombia and the Caribbean. Plus: Camille finally understands she must leave her loved ...",positive,0.8661102056503296,schizophrenia
Eli Lilly Said To Play Down Risk of Top Pill,The New York Times,2006,"The drug maker Eli Lilly has engaged in a decade-long effort to play down the health risks of Zyprexa, its best-selling medication for schizophrenia, according to hundreds of internal Lilly documents and e-mail messages among top company ...",positive,0.8564127087593079,schizophrenia
"How to Fix Your Life in 2004 --- Rethinking Your Vices: New Excuses to Smoke, Eat Pizza, Be a Slob",The Wall Street Journal,2003,"AS THE CLOCK ticks toward 2004, you might be tempted to dash off a list of self-improvements for the New Year -- like actually visiting the gym you pay for, or cutting back on reality TV.",positive,0.8546220064163208,schizophrenia
A Proper Burial for the Lost Children of Tuam: The Week in Reporter Reads,NYTimes.com Feed,2022,"Five articles from around The Times, narrated just for you. This weekend, listen to a collection of articles from around The New York Times, read aloud by the reporters who wrote them.",positive,0.8541778922080994,schizophrenia
"From a bunker to back on track ; With VA's help, Rounds is getting off the streets",Buffalo News,2011,"After living for years in cardboard boxes, makeshift tents, junkyard trailers and even an underground bunker, Clarence O. Rounds is thankful to be back on society's grid.",positive,0.850631833076477,schizophrenia
